Soru,Cevap
İnkilap aşamalarından Propaganda ve Hazirlik Döneminin amacı nedir .,Taraftar Kazanmak.
düzeni yikip yerine yeni bir düzen kurmay ifade eden kavram,Inkilâp
Mevcut devlet düzenini siddet kullanarak, yasadisi yollarla yikmak için girisilen halk hareketidir.,Ihtilal
Toplumsal evrim bir toplumsal degisim modelidir.Inkilaptan farkl olarak bu degisimde ___ yoktur.,Zorlama
Isyan: toplum içindeki belli bir grubun veya bir örgütün, ____e karsi ayaklanmasidir.,Devlet
Ihtilalde amaç devlet düzenini yıkmakken. Hükümet darbedesinde amaç _____ ele geçirmektir,Iktidar
Mıhtıra kimin kimi uyarmasıdır,Ordunun devleti
Turkiye tarihindeki Muhtıra hangi isimle bilinir?(___ Muhtırası),12 Mart
Aşağıdakilerden hangisinin kabul edilmemesi durumu savaşa yol açabilir,Ültimatom
Devletlerin birbirine verdiği diplomatik uyarı yazıları,Nota
Osmanlı hangi yüzyıldan itibaren duraklama sürecine girmistir?,16.yy
Askeri bilgisi ve basarisi olanlar yerine kimler alındıgı için Tımarlı Sipahiler bozulmuştur.,hazineye pesin para ödeyenlere
Ekonomik yapinin bozulmasinin nedeni hangisidir 1 Sanayi inkilābi 2 Kapitülasyonlar 3 Cografi Kesifler:,Üçü de
Osmanlının 1875'te ilan ettiği Moratoryum neyi ifade eder.,Borçlarını ödeyemediğini
1731 yilinda I. Mahmut döneminde Fransiz asillI Comte de Bonneval'in yardımı ile açılan kurum,Hendesehane
Hendesehanelerin Topçu Ocaginina ne öğretmesi amaçlanmıştır,matematik ve fen bilimleri
III. Mustafa zamaninda Baron de Tott'un öncülügünde açılan yüksek bir okulun ismi.,Mühendishane-i Bahr- i Hümayun
III. Selim zamanında Kurulan ordunun ismi,3-Nizam-1 Cedit
Nizam-1 Cedit ordusunun giderlerini karşılamak için kurulan hazinenin ismi,irad-ı Cedit
III. Selim zamanında kurulan Kara Kuvvetleri Mühendislik Okulunun ismi.,Mühendishane-i Berri Hümayun
II.Mahmut hangi orduyu kaldırıp yerine "Asakiri Mansurei Muhammediye" ordusu kurdu?,Yeniçeri Ocağı
Mahallelerde muhtarlik sistemi kurup Osmanlı'da ilk nüfus sayimi yapan padişah kimdir.,2.Mahmut
ilk resmi gazete Takvim-i Vekayı,ilk demir yolu inşaasını vee fesi resmi kıyafet yapan padisah _.Mahmut,İkinci
Tanzimat Fermanı Osmanlının hangi sisteme geçişine adım attırmıştır,Bati tipi hak ve özgürlükler
Tanzimatan önce eyalet sistemiyle yönetilen Osmanli tanzimatla birlikte __ sistemine geçmistir.,Merkezi Vilayet
Osmanlı'da ilk kez ___ ile seçme ve seçilme yoluyla kisilere siyasi haklar verilmistir.,1876 anayasasi
ittihat Ve Terakkiciler 1908 yilinda ___ yönetimine isyan ederek II. Mesrutiyeti ilan ettirmislerdir.,II Abdulhamid
II. Abdülhamit'i tahttan indiren cemiyet,ittihat Ve Terakkiciler
Osmanli' da II. Abdülhamit'in istib da yönetimine karŞI ___ adi verilen aydinlar hareket baslamistir.,Jön Türk
düzeni yıkıp yeni düzen kurmak,inkilap



